Código do SIORG,Nome,Sigla,Tipo de Instituição,Pais,Estado,Cidade,Esfera,Poder,Natureza Jurídica,SISP,CNPJ
46,Advocacia Geral da União,AGU,Pública,Brasil,DF,Brasilia,Federal,Executivo,Administração Direta,Sim,00.394.411/0008-85
45104,Agência Brasileira de Inteligência,ABIN,Pública,Brasil,DF,Brasilia,Federal,Executivo,Administração Direta,Sim,01.175.497/0001-41
4243,Agência Espacial Brasileira,AEB,Pública,Brasil,DF,Brasilia,Federal,Executivo,Autarquia,Sim,86.900.545/0001-70
46876,Agência Nacional de Águas,ANA,Pública,Brasil,DF,Brasilia,Federal,Executivo,Autarquia,Sim,26.994.558/0001-23
86144,Agência Nacional de Aviação Civil,ANAC,Pública,Brasil,DF,Brasilia,Federal,Executivo,Autarquia,Sim,07.947.821/0001-89
21089,Agência Nacional de Energia Elétrica ,ANEEL,Pública,Brasil,DF,Brasilia,Federal,Executivo,Autarquia,Sim,02.270.669/0001-29
45013,Agência Nacional de Saúde Suplementar ,ANS,Pública,Brasil,RJ,Rio de Janeiro,Federal,Executivo,Autarquia,Sim,03.589.068/0001-46
25064,Agência Nacional de Telecomunicações ,ANATEL,Pública,Brasil,DF,Brasilia,Federal,Executivo,Autarquia,Sim,02.030.715/0001-12
54843,Agência Nacional de Transportes Aquaviários,ANTAG,Pública,Brasil,DF,Brasilia,Federal,Executivo,Autarquia,Sim,04.903.587/0001-08
54793,Agência Nacional de Transportes Terrestres ,ANTT,Pública,Brasil,DF,Brasilia,Federal,Executivo,Autarquia,Sim,04.898.488/0001-77
36687,Agência Nacional de Vigilância Sanitária ,ANVISA,Pública,Brasil,DF,Brasilia,Federal,Executivo,Autarquia,Sim,03.112.386/0001-11
57682,Agência Nacional do Cinema ,ANCINE,Pública,Brasil,RJ,Rio de Janeiro,Federal,Executivo,Autarquia,Sim,04.884.574/0001-20
25281,"Agência Nacional do Petróleo, Gás Natural e Biocombustíveis ",ANP,Pública,Brasil,RJ,Rio de Janeiro,Federal,Executivo,Autarquia,Sim,02.313.673/0001-27
334,Arquivo Nacional ,AN,Pública,Brasil,RJ,Rio de Janeiro,Federal,Executivo,Empresa Pública,Sim,04.374.067/0001-47
89,Banco Central do Brasil ,BCB,Pública,Brasil,DF,Brasilia,Federal,Executivo,Autarquia,Sim,00.038.166/0001-05
57952,Centro de Tecnologia da Informação Renato Archer ,CTI,Pública,Brasil,SP,Campinas,Federal,Executivo,Empresa Pública,Sim,04.822.500/0002-40
448,Centro Federal de Educação Tecnológica ´Celso Suckow  da Fonseca´,CEFET-RJ,Pública,Brasil,RJ,Rio de Janeiro,Federal,Executivo,Autarquia,Sim,42.441.758/0001-05
445,Centro Federal de Educação Tecnológica de Minas Gerais ,CEFET-MG,Pública,Brasil,MG,Belo Horizonte,Federal,Executivo,Autarquia,Sim,17.220.203/0001-96
256,Colégio Pedro II ,CP II,Pública,Brasil,RJ,Rio de Janeiro,Federal,Executivo,Autarquia,Sim,42.414.284/0001-02
48,Comando da Aeronáutica ,COMAER,Pública,Brasil,DF,Brasilia,Federal,Executivo,Administração Direta,Sim,00.394.429/0001-00
185,Comando da Marinha ,CMAR,Pública,Brasil,DF,Brasilia,Federal,Executivo,Administração Direta,Sim,00.394.502/0001-44
94,Comando do Exército ,CEX,Pública,Brasil,DF,Brasilia,Federal,Executivo,Administração Direta,Sim,00.394.452/0001-03
478,Comissão de Valores Mobiliários ,CVM,Pública,Brasil,RJ,Rio de Janeiro,Federal,Executivo,Autarquia,Sim,29.507.878/0002-80
223,Comissão Nacional de Energia Nuclear ,CNEM,Pública,Brasil,RJ,Rio de Janeiro,Federal,Executivo,Autarquia,Sim,00.402.552/0001-26
322,Conselho Administrativo de Defesa Econômica,CADE,Pública,Brasil,DF,Brasilia,Federal,Executivo,Administração Direta,Sim,00.418.993/0001-16
8,Conselho Nacional de Desenvolvimento Científico e Tecnológico,CNPG,Pública,Brasil,DF,Brasilia,Federal,Executivo,Fundação,Sim,33.654.831/0001-36
3620,Controladoria Geral da União ,CGU,Pública,Brasil,DF,Brasilia,Federal,Executivo,Administração Direta,Sim,05.914.685/0001-03
250,Coordenação de Aperfeiçoamento de Pessoal de Nível Superior ,CAPES,Pública,Brasil,DF,Brasilia,Federal,Executivo,Empresa Pública,Sim,00.889.834/0001-08
324,Departamento de Polícia Federal ,DPF,Pública,Brasil,DF,Brasilia,Federal,Executivo,Autarquia,Sim,00.394.494/0014-50
704,Departamento de Polícia Rodoviária Federal ,DPRF,Pública,Brasil,DF,Brasilia,Federal,Executivo,Autarquia,Sim,00.394.494/0014-50
54844,Departamento nacional de Infraestrutura de Transportes,DNIT,Pública,Brasil,DF,Brasilia,Federal,Executivo,Autarquia,Sim,04.892.707/0001-00
367,Departamento Nacional de Obras Contra as Secas ,DNOCS,Pública,Brasil,CE,Fortaleza,Federal,Executivo,Autarquia,Sim,00.043.711/0001-43
1918,Departamento Nacional de Produção Mineral ,DNPM,Pública,Brasil,DF,Brasilia,Federal,Executivo,Autarquia,Sim,00.381.056/0001-33
86567,Empresa Brasil de Comunicação,EBC,Pública,Brasil,DF,Brasilia,Federal,Executivo,Empresa Pública,Sim,09.168.704/0001-42
119672,Empresa de Planejamento e Logística ,EPL,Pública,Brasil,DF,Brasilia,Federal,Executivo,Empresa Pública,Sim,15.763.423/0001-30
1013,Empresa Gerencial de Projetos Navais ,EMGEPRON,Pública,Brasil,RJ,Rio de Janeiro,Federal,Executivo,Empresa Pública,Sim,27.816.487/0001-31
344,Escola de Administração Fazendária ,ESAF,Pública,Brasil,DF,Brasilia,Federal,Executivo,Autarquia,Sim,02.317.176/0001-05
299,Fundação Alexandre de Gusmão,FUNAG,Pública,Brasil,DF,Brasilia,Federal,Executivo,Fundação,Sim,00.662.197/0001-24
984,Fundação Biblioteca Nacional ,FBN,Pública,Brasil,RJ,Rio de Janeiro,Federal,Executivo,Fundação,Sim,40.176.679/0001-99
261,Fundação Casa de Rui Barbosa ,FCRB,Pública,Brasil,RJ,Rio de Janeiro,Federal,Executivo,Fundação,Sim,42.519.488/0001-08
1782,Fundação Cultural Palmares ,FCP,Pública,Brasil,DF,Brasilia,Federal,Executivo,Fundação,Sim,32.901.688/0001-77
956,Fundação Escola Nacional de Administração Pública ,ENAP,Pública,Brasil,DF,Brasilia,Federal,Executivo,Fundação,Sim,00.627.612/0001-09
3,Fundação Instituto Brasileiro de Geografia e Estátistica ,IBGE,Pública,Brasil,RJ,Rio de Janeiro,Federal,Executivo,Fundação,Sim,33.787.094/0001-40
7,Fundação Instituto de Pesquisa Econômica Aplicada ,IPEA,Pública,Brasil,DF,Brasilia,Federal,Executivo,Fundação,Sim,03.892.175/0001-00
257,Fundação Joaquim Nabuco ,FUNDAJ,Pública,Brasil,PE,Recife,Federal,Executivo,Fundação,Sim,09.773.169/0001-59
221,"Fundação Jorge Duprat Figueiredo, de Segurança e Medicina do Trabalho ",FUNDACENTRO,Pública,Brasil,SP,São Paulo,Federal,Executivo,Fundação,Sim,62.428.073/0001-36
2330,Fundação Nacional de Artes ,FUNARTE,Pública,Brasil,RJ,Rio de Janeiro,Federal,Executivo,Fundação,Sim,26.963.660/0002-42
2207,Fundação Nacional de Saúde ,FUNASA,Pública,Brasil,DF,Brasilia,Federal,Executivo,Fundação,Sim,26.989.350/0001-16
173,Fundação Nacional do Índio ,FUNAI,Pública,Brasil,DF,Brasilia,Federal,Executivo,Fundação,Sim,00.059.311/0001-26
315,Fundação Oswaldo Cruz ,FIOCRUZ,Pública,Brasil,RJ,Rio de Janeiro,Federal,Executivo,Fundação,Sim,33.781.055/0012-98
470,Fundação Universidade de Brasília,UNB,Pública,Brasil,DF,Brasilia,Federal,Executivo,Fundação,Sim,00.038.174/0001-43
465,Fundação Universidade do Amazonas ,UFAM,Pública,Brasil,AM,Manaus,Federal,Executivo,Fundação,Sim,04.378.626/0001-97
84712,Fundação Universidade Federal da Grande Dourados ,UFGD,Pública,Brasil,MS,Dourados,Federal,Executivo,Fundação,Sim,07.775.847/0001-97
970,Fundação Universidade Federal de Ciências da Saúde de Porto Alegre ,UFCSPA,Pública,Brasil,RS,Porto Alegre,Federal,Executivo,Fundação,Sim,92.967.595/0001-77
471,Fundação Universidade de Mato Grosso ,UFMT,Pública,Brasil,MT,Cuiabá,Federal,Executivo,Fundação,Sim,33.004.540/0001-00
827,Fundação Universidade Federal do Mato Grosso do Sul ,UFMS,Pública,Brasil,MS,Campo Grande,Federal,Executivo,Fundação,Sim,15.461.510/0001-33
477,Fundação Universidade Federal de Pelotas ,UFPel,Pública,Brasil,RS,Pelotas,Federal,Executivo,Fundação,Sim,92.242.080/0001-00
1209,Fundação Universidade Federal de Rondônia ,UNIR,Pública,Brasil,RO,Porto Velho,Federal,Executivo,Fundação,Sim,04.418.943/0001-90
1605,Fundação Universidade Federal de Roraima ,UFRR,Pública,Brasil,RR,Boa Vista,Federal,Executivo,Fundação,Sim,34.792.077/0001-63
475,Fundação Universidade Federal de São Carlos ,UFSCar,Pública,Brasil,SP,Sorocaba,Federal,Executivo,Fundação,Sim,45.358.058/0001-40
1734,Fundação Universidade Federal de São João Del Rei ,FUNREI,Pública,Brasil,MG,São João del-Rei,Federal,Executivo,Fundação,Sim,00.394.445/0518-65
469,Fundação Universidade Federal de Sergipe ,UFS,Pública,Brasil,SE,São Cristóvão,Federal,Executivo,Fundação,Sim,13.031.547/0001-04
474,Fundação Universidade de Viçosa ,UFV,Pública,Brasil,MG,Viçosa,Federal,Executivo,Fundação,Sim,25.944.455/0001-96
84703,Fundação Universidade Federal do ABC ,UFABC,Pública,Brasil,SP,Santo André,Federal,Executivo,Fundação,Sim,07.722.779/0001-06
466,Fundação Universidade Federal do Acre ,UFAC,Pública,Brasil,AC,Rio Branco,Federal,Executivo,Fundação,Sim,04.071.106/0001-37
1710,Fundação Universidade Federal do Amapá,UNIFAP,Pública,Brasil,AP,Macapá,Federal,Executivo,Fundação,Sim,34.868.257/0001-81
467,Fundação Universidade Federal do Maranhão ,UFMA,Pública,Brasil,MA,São Luis,Federal,Executivo,Fundação,Sim,06.279.103/0001-19
94739,Fundação Universidade Federal do Pampa ,UNIPAMPA,Pública,Brasil,RS,Bagé,Federal,Executivo,Fundação,Sim,09.341.233/0001-22
468,Fundação Universidade Federal do Piauí ,UFPI,Pública,Brasil,PI,Teresina,Federal,Executivo,Fundação,Sim,06.517.387/0001-34
476,Fundação Universidade do Rio Grande ,FURG,Pública,Brasil,RS,Rio Grande,Federal,Executivo,Fundação,Sim,94.877.586/0001-10
52702,Fundação Universidade Federal do Tocantins ,UFT,Pública,Brasil,TO,Palmas,Federal,Executivo,Fundação,Sim,05.149.726/0001-04
69624,Fundação Universidade Federal do Vale do São Francisco ,UNIVASF,Pública,Brasil,PE,Petrolina,Federal,Executivo,Fundação,Sim,05.440.725/0001-14
253,Fundo Nacional de Desenvolvimento da Educação ,FNDE,Pública,Brasil,DF,Brasilia,Federal,Executivo,Autarquia,Sim,00.378.257/0001-81
35,Hospital das Forças Armadas ,HFA,Pública,Brasil,DF,Brasilia,Federal,Executivo,Autarquia,Sim,03.568.867/0001-36
332,Imprensa Nacional ,IN,Pública,Brasil,DF,Brasilia,Federal,Executivo,Autarquia,Sim,04.196.645/0001-00
12,Instituto Brasileiro de Informação em Ciência e Tecnologia ,IBICT,Pública,Brasil,DF,Brasilia,Federal,Executivo,Autarquia,Sim,04.082.993/0001-49
100584,Instituto Brasileiro de Museus ,IBRAM,Pública,Brasil,DF,Brasilia,Federal,Executivo,Autarquia,Sim,10.898.596/0001-42
241,Instituto Brasileiro de Turismo ,EMBRATUR,Pública,Brasil,DF,Brasilia,Federal,Executivo,Autarquia,Sim,33.741.794/0001-01
1812,Instituto Brasileiro do Meio Ambiente e dos Recursos Naturais Renováveis ,IBAMA,Pública,Brasil,DF,Brasilia,Federal,Executivo,Autarquia,Sim,03.659.166/0028-22
91842,Instituto Chico Mendes de Conservação da Biodiversidade ,ICMBio,Pública,Brasil,DF,Brasilia,Federal,Executivo,Autarquia,Sim,08.829.974/0001-94
1913,Instituto de Pesquisas Jardim Botânico do Rio de Janeiro ,JBRJ,Pública,Brasil,RJ,Rio de Janeiro,Federal,Executivo,Autarquia,Sim,04.936.616/0001-20
2045,Instituto do Patrimônio Histórico e Artístico Nacional ,IPHAN,Pública,Brasil,DF,Brasilia,Federal,Executivo,Autarquia,Sim,26.474.056/0001-71
456,"Instituto Federal de Educação, Ciência e Tecnologia  Sul-Rio-Grandense",IFSUL,Pública,Brasil,RS,Pelotas,Federal,Executivo,Autarquia,Sim,10.729.992/0004-99
100920,"Instituto Federal de Educação, Ciência e Tecnologia Baiano ",IFBAIANO,Pública,Brasil,BA,Salvador,Federal,Executivo,Autarquia,Sim,10.724.903/0001-79
100919,"Instituto Federal de Educação, Ciência e Tecnologia Catarinense ",IFC,Pública,Brasil,SO,Blumenau,Federal,Executivo,Autarquia,Sim,10.635.424/0001-86
444,"Instituto Federal de Educação, Ciência e Tecnologia da Bahia ",IFBA ,Pública,Brasil,BA,Salvador,Federal,Executivo,Autarquia,Sim,10.764.307/0001-12
100905,"Instituto Federal de Educação, Ciência e Tecnologia da Paraíba ",IFPB,Pública,Brasil,PB,João Pessoa,Federal,Executivo,Autarquia,Sim,10.783.898/0001-75
100900,"Instituto Federal de Educação, Ciência e Tecnologia de Alagoas ",IFAL,Pública,Brasil,AL,Maceió,Federal,Executivo,Autarquia,Sim,10.825.373/0001-55
94430,"Instituto Federal de Educação, Ciência e Tecnologia de Brasília ",IFB,Pública,Brasil,DF,Brasilia,Federal,Executivo,Autarquia,Sim,10.791.831/0001-82
451,"Instituto Federal de Educação, Ciência e Tecnologia de Goiás ",IFGO,Pública,Brasil,GO,Goiânia,Federal,Executivo,Autarquia,Sim,10.870.883/0001-44
100914,"Instituto Federal de Educação, Ciência e Tecnologia de Minas Gerais ",IFMG,Pública,Brasil,MG,Belo Horizonte,Federal,Executivo,Autarquia,Sim,10.626.896/0001-72
100922,"Instituto Federal de Educação, Ciência e Tecnologia de Pernambuco ",IFPE,Pública,Brasil,PE,Recife,Federal,Executivo,Autarquia,Sim,10.767.239/0001-45
100907,"Instituto Federal de Educação, Ciência e Tecnologia de Rondônia ",IFRO,Pública,Brasil,RO,Porto Velho,Federal,Executivo,Autarquia,Sim,10.817.343/0001-05
3561,"Instituto Federal de Educação, Ciência e Tecnologia de Roraima ",IFRR,Pública,Brasil,RR,Boa Vista,Federal,Executivo,Autarquia,Sim,10.839.508/0001-31
455,"Instituto Federal de Educação, Ciência e Tecnologia de Santa Catarina ",IFSC,Pública,Brasil,SC,Florianópolis,Federal,Executivo,Autarquia,Sim,11.402.887/0001-60
453,"Instituto Federal de Educação, Ciência e Tecnologia de São Paulo",IFSP,Pública,Brasil,SP,São Paulo,Federal,Executivo,Autarquia,Sim,10.882.594/0001-65
100909,"Instituto Federal de Educação, Ciência e Tecnologia de Sergipe ",IFS,Pública,Brasil,SE,Aracaju,Federal,Executivo,Autarquia,Sim,10.728.444/0001-00
94427,"Instituto Federal de Educação, Ciência e Tecnologia do Acre ",IFAC,Pública,Brasil,AC,Rio Branco,Federal,Executivo,Autarquia,Sim,10.918.674/0001-23
94428,"Instituto Federal de Educação, Ciência e Tecnologia do Amapá ",IFAP,Pública,Brasil,AP,Macapá,Federal,Executivo,Autarquia,Sim,10.820.882/0001-95
100910,"Instituto Federal de Educação, Ciência e Tecnologia do Amazonas ",IFAM,Pública,Brasil,AM,Manaus,Federal,Executivo,Autarquia,Sim,10.792.928/0001-00
100911,"Instituto Federal de Educação, Ciência e Tecnologia do Ceará ",IFCE,Pública,Brasil,CE,Fortaleza,Federal,Executivo,Autarquia,Sim,10.744.098/0001-45
100912,"Instituto Federal de Educação, Ciência e Tecnologia do Espírito Santo ",IFES,Pública,Brasil,ES,Vitória,Federal,Executivo,Autarquia,Sim,10.838.653/0001-06
100921,"Instituto Federal de Educação, Ciência e Tecnologia do Maranhão ",IFMA,Pública,Brasil,MA,São Luis,Federal,Executivo,Autarquia,Sim,10.735.145/0001-94
100916,"Instituto Federal de Educação, Ciência e Tecnologia de Mato Grosso  ",IFMT,Pública,Brasil,MT,Cuiabá,Federal,Executivo,Autarquia,Sim,10.784.782/0001-50
100904,"Instituto Federal de Educação, Ciência e Tecnologia do Mato Grosso do Sul ",IFMS,Pública,Brasil,MS,Campo Grande,Federal,Executivo,Autarquia,Sim,10.673.078/0001-20
100901,"Instituto Federal de Educação, Ciência e Tecnologia do Norte de Minas Gerais ",IFNMG,Pública,Brasil,MG,Montes Claros,Federal,Executivo,Autarquia,Sim,10.727.655/0001-10
100917,"Instituto Federal de Educação, Ciência e Tecnologia do Pará ",IFPA,Pública,Brasil,PA,Belém,Federal,Executivo,Autarquia,Sim,10.763.998/0001-30
49103,"Instituto Federal de Educação, Ciência e Tecnologia do Paraná ",IFPR,Pública,Brasil,PR,Curitiba,Federal,Executivo,Autarquia,Sim,10.652.179/0001-15
434,"Instituto Federal de Educação, Ciência e Tecnologia do Piauí ",IFPI,Pública,Brasil,PI,Teresina,Federal,Executivo,Autarquia,Sim,10.806.496/0001-49
100930,"Instituto Federal de Educação, Ciência e Tecnologia do Rio de Janeiro ",IFRJ,Pública,Brasil,RJ,Rio de Janeiro,Federal,Executivo,Autarquia,Sim,10.952.708/0001-04
439,"Instituto Federal de Educação, Ciência e Tecnologia do Rio Grande do Norte ",IFRN,Pública,Brasil,RN,Natal,Federal,Executivo,Autarquia,Sim,10.877.412/0001-68
100918,"Instituto Federal de Educação, Ciência e Tecnologia do Rio Grande do Sul ",IFRS,Pública,Brasil,RS,Bento Gonçalves,Federal,Executivo,Autarquia,Sim,10.637.926/0001-46
46784,"Instituto Federal de Educação, Ciência e Tecnologia do Sertão Pernambucano ",IFSERTAO-PE,Pública,Brasil,PE,Petrolina,Federal,Executivo,Autarquia,Sim,10.830.301/0001-04
100902,"Instituto Federal de Educação, Ciência e Tecnologia do Sudeste de Minas Gerais ",IFMGSE,Pública,Brasil,MG,Juiz de Fora,Federal,Executivo,Autarquia,Sim,10.723.648/0002-20
100915,"Instituto Federal de Educação, Ciência e Tecnologia do Sul de Minas Gerais ",IFSuldeminas,Pública,Brasil,MG,Pouso Alegre,Federal,Executivo,Autarquia,Sim,10.648.539/0001-05
100908,"Instituto Federal de Educação, Ciência e Tecnologia doTocantins ",IFTO,Pública,Brasil,TO,Palmas,Federal,Executivo,Autarquia,Sim,10.742.006/0001-98
100903,"Instituto Federal de Educação, Ciência e Tecnologia do Triângulo Mineiro ",IFTM,Pública,Brasil,MG,Uberaba,Federal,Executivo,Autarquia,Sim,10.695.891/0001-00
100906,"Instituto Federal de Educação, Ciência e Tecnologia Farroupilha ",IFFarroupilha,Pública,Brasil,RS,São Vicente do Sul,Federal,Executivo,Autarquia,Sim,10.662.072/0001-58
100931,"Instituto Federal de Educação, Ciência e Tecnologia Fluminense ",IFFluminense,Pública,Brasil,RJ,Campos dos Goytacazes,Federal,Executivo,Autarquia,Sim,10.779.511/0001-07
100913,"Instituto Federal de Educação, Ciência e Tecnologia Goiano ",IFgoiano,Pública,Brasil,GO,Goiânia,Federal,Executivo,Autarquia,Sim,10.651.417/0001-78
382,Instituto Nacional da Propriedade Industrial ,INPI,Pública,Brasil,RJ,Rio de Janeiro,Federal,Executivo,Autarquia,Sim,42.521.088/0009-94
2409,Instituto Nacional de Câncer José Alencar Gomes da Silva ,INCA,Pública,Brasil,RJ,Rio de Janeiro,Federal,Executivo,Autarquia,Sim,00.394.544/0171-50
14769,Instituto Nacional de Cardiologia ,INC/SAS,Pública,Brasil,RJ,Rio de Janeiro,Federal,Executivo,Autarquia,Sim,00.394.544/0213-44
1799,Instituto Nacional de Colonização e Reforma Agrária ,INCRA,Pública,Brasil,DF,Brasilia,Federal,Executivo,Autarquia,Sim,00.375.972/0002-41
249,Instituto Nacional de Estudos e Pesquisas Educacionais Anísio Teixeira ,INEP,Pública,Brasil,DF,Brasilia,Federal,Executivo,Autarquia,Sim,01.678.363/0001-43
2030,Instituto Nacional de Meteorologia ,INMET,Pública,Brasil,DF,Brasilia,Federal,Executivo,Autarquia,Sim,00.396.895/0010-86
240,"Instituto Nacional de Metrologia, Qualidade e Tecnologia ",INMETRO,Pública,Brasil,RJ,Duque de Caxias,Federal,Executivo,Autarquia,Sim,00.662.270/0003-20
10,Instituto Nacional de Pesquisas Espaciais ,INPE,Pública,Brasil,SP,São José dos Campos,Federal,Executivo,Autarquia,Sim,01.263.896/0005-98
11,Instituto Nacional de Pesquisas da Amazônia ,INPA,Pública,Brasil,AM,Manaus,Federal,Executivo,Autarquia,Sim,01.263.896/0015-60
232,Instituto Nacional de Tecnologia ,INT,Pública,Brasil,RJ,Rio de Janeiro,Federal,Executivo,Autarquia,Sim,01.263.896/0004-07
47388,Instituto Nacional de Tecnologia da Informação ,ITI,Pública,Brasil,DF,Brasilia,Federal,Executivo,Autarquia,Sim,04.039.532/0002-74
1934,Instituto Nacional do Seguro Social ,INSS,Pública,Brasil,DF,Brasilia,Federal,Executivo,Autarquia,Sim,00.394.528/0004-35
982,Laboratório Nacional de Computação Científica ,LNCC,Pública,Brasil,RJ,Petrópolis,Federal,Executivo,Administração Direta,Sim,04.079.233/0001-82
14,"Ministério da Agricultura, Pecuária e Abastecimento ",MAPA,Pública,Brasil,DF,Brasilia,Federal,Executivo,Administração Direta,Sim,00.396.895/0072-19
1988,"Ministério da Ciência, Tecnologia e Inovação ",MCTI,Pública,Brasil,DF,Brasilia,Federal,Executivo,Administração Direta,Sim,03.132.745/0001-00
1926,Ministério da Cultura ,MinC,Pública,Brasil,DF,Brasilia,Federal,Executivo,Administração Direta,Sim,01.264.142/0007-14
41066,Ministério da Defesa ,MD,Pública,Brasil,DF,Brasilia,Federal,Executivo,Administração Direta,Sim,00.394.411/0005-32
244,Ministério da Educação ,MEC,Pública,Brasil,DF,Brasilia,Federal,Executivo,Administração Direta,Sim,00.394.445/0001-01
1929,Ministério da Fazenda ,MF,Pública,Brasil,DF,Brasilia,Federal,Executivo,Administração Direta,Sim,00.394.460/0185-12
42670,Ministério da Integração Nacional ,MI ,Pública,Brasil,DF,Brasilia,Federal,Executivo,Administração Direta,Sim,03.353.358/0001-96
316,Ministério da Justiça ,MJ,Pública,Brasil,DF,Brasilia,Federal,Executivo,Administração Direta,Sim,00.394.494/0018-84
72083,Ministério da Pesca e Aquicultura ,MPA,Pública,Brasil,DF,Brasilia,Federal,Executivo,Administração Direta,Sim,05.482.692/0001-75
1930,Ministério da Previdência Social ,MPS,Pública,Brasil,DF,Brasilia,Federal,Executivo,Administração Direta,Sim,00.394.528/0001-92
304,Ministério da Saúde ,MS,Pública,Brasil,DF,Brasilia,Federal,Executivo,Administração Direta,Sim,00.394.544/0127-87
42672,Ministério das Cidades ,Mcidades,Pública,Brasil,DF,Brasilia,Federal,Executivo,Administração Direta,Sim,05.465.986/0001-99
3159,Ministério das Comunicações ,MC,Pública,Brasil,DF,Brasilia,Federal,Executivo,Administração Direta,Sim,00.394.437/0004-08
263,Ministério das Relações Exteriores ,MRE,Pública,Brasil,DF,Brasilia,Federal,Executivo,Administração Direta,Sim,00.394.437/0004-08
2852,Ministério de Minas e Energia ,MME,Pública,Brasil,DF,Brasilia,Federal,Executivo,Administração Direta,Sim,37.115.383/0001-53
17125,Ministério do Desenvolvimento Agrário ,MDA,Pública,Brasil,DF,Brasilia,Federal,Executivo,Administração Direta,Sim,01.612.452/0001-97
1945,Ministério do Desenvolvimento Social e Combate à Fome ,MDS,Pública,Brasil,DF,Brasilia,Federal,Executivo,Administração Direta,Sim,05.756.246/0001-01
3162,"Ministério do Desenvolvimento, Indústria e Comércio Exterior ",MDIC,Pública,Brasil,DF,Brasilia,Federal,Executivo,Administração Direta,Sim,00.394.478/0001-43
36670,Ministério do Esporte ,ME ,Pública,Brasil,DF,Brasilia,Federal,Executivo,Administração Direta,Sim,28.523.215/0001-06
1927,Ministério do Meio Ambiente ,MMA,Pública,Brasil,DF,Brasilia,Federal,Executivo,Administração Direta,Sim,00.394.411/0043-68
2981,"Ministério do Planejamento, Orçamento e Gestão ",MPOG,Pública,Brasil,DF,Brasilia,Federal,Executivo,Administração Direta,Sim,00.489.828/0002-36
2844,Ministério do Trabalho e Emprego ,MTE,Pública,Brasil,DF,Brasilia,Federal,Executivo,Administração Direta,Sim,37.115.367/0001-60
72084,Ministério do Turismo ,Mtur,Pública,Brasil,DF,Brasilia,Federal,Executivo,Administração Direta,Sim,05.457.283/0001-19
2846,Ministério dos Transportes,MT,Pública,Brasil,DF,Brasilia,Federal,Executivo,Administração Direta,Sim,37.115.342/0032-63
24755,Museu de Astronomia e Ciências Afins ,MAST,Pública,Brasil,RJ,Rio de Janeiro,Federal,Executivo,Administração Direta,Sim,16.714.695/0001-03
24712,Museu Paraense Emílio Goeldi ,MPEG,Pública,Brasil,PA,Belém,Federal,Executivo,Administração Direta,Sim,04.108.782/0001-38
346,Observatório Nacional ,ON,Pública,Brasil,RJ,Rio de Janeiro,Federal,Executivo,Administração Direta,Sim,04.053.755/0001-05
78,Procuradoria-Geral da Fazenda Nacional,PGFN,Pública,Brasil,DF,Brasilia,Federal,Executivo,Administração Direta,Sim,00.394.460/0216-53
77,Secretaria da Receita Federal ,SRF,Pública,Brasil,DF,Brasilia,Federal,Executivo,Administração Direta,Sim,00.394.460/0058-53
115257,Secretaria de Aviação Civil ,SAC,Pública,Brasil,DF,Brasilia,Federal,Executivo,Administração Direta,Sim,07.947.821/0001-89
1801,Secretaria de Direitos Humanos ,SDH,Pública,Brasil,DF,Brasilia,Federal,Executivo,Administração Direta,Sim,05.478.625/0001-87
3495,Secretaria de Logística e Tecnologia da Informação ,SLTI,Pública,Brasil,DF,Brasilia,Federal,Executivo,Administração Direta,Sim,10.498.974/0001-09
119335,Secretaria Nacional do Consumidor ,SENACON,Pública,Brasil,DF,Brasilia,Federal,Executivo,Administração Direta,Sim,00.394.494/0005-60
2032,Secretaria de Orçamento Federal ,SOF,Pública,Brasil,DF,Brasilia,Federal,Executivo,Administração Direta,Sim,00.489.828/0008-21
92748,Secretaria de Portos da Presidência da República,SEP,Pública,Brasil,DF,Brasilia,Federal,Executivo,Administração Direta,Sim,08.855.874/0001-32
1986,Secretaria do Patrimônio da União ,SPU,Pública,Brasil,DF,Brasilia,Federal,Executivo,Administração Direta,Sim,00.489.828/0009-02
1696,Secretaria do Tesouro Nacional ,STN,Pública,Brasil,DF,Brasilia,Federal,Executivo,Administração Direta,Sim,00.394.460/0409-50
42673,Secretaria-Geral da Presidência da República,SGPR,Pública,Brasil,DF,Brasilia,Federal,Executivo,Administração Direta,Sim,07.490.910/0001-49
89539,Serviço Florestal Brasileiro ,SFB,Pública,Brasil,DF,Brasilia,Federal,Executivo,Autarquia,Sim,37.115.375/0008-83
166,Superintendência da Zona Franca de Manaus ,SUFRAMA,Pública,Brasil,AM,Manaus,Federal,Executivo,Autarquia,Sim,04.407.029/0001-43
235,Superintendência de Seguros Privados ,SUSEP,Pública,Brasil,RJ,Rio de Janeiro,Federal,Executivo,Autarquia,Sim,42.354.068/0008-95
91138,Superintendência do Desenvolvimento da Amazônia ,SUDAM,Pública,Brasil,PA,Belém,Federal,Executivo,Autarquia,Sim,09.203.665/0001-77
100113,Superintendência do Desenvolvimento do Centro-Oeste ,SUDECO,Pública,Brasil,DF,Brasília,Federal,Executivo,Autarquia,Sim,13.802.028/0001-94
91144,Superintendência do Desenvolvimento do Nordeste ,SUDENE,Pública,Brasil,PE,Recife,Federal,Executivo,Autarquia,Sim,09.263.130/0001-91
105915,Superintendência Nacional de Previdência Complementar ,PREVIC,Pública,Brasil,DF,Brasilia,Federal,Executivo,Autarquia,Sim,07.290.290/0004-47
109912,Universidade da Integração Internacional da Lusofonia Afro-Brasileira,UNILAB,Pública,Brasil,CE,Fortaleza,Federal,Executivo,Autarquia,Sim,12.397.930/0001-00
421,Universidade Federal da Bahia ,UFBA,Pública,Brasil,BA,Salvador,Federal,Executivo,Autarquia,Sim,15.180.714/0001-04
103730,Universidade Federal da Fronteira Sul ,UFFS,Pública,Brasil,SC,Chapecó,Federal,Executivo,Autarquia,Sim,11.234.780/0001-50
